{
  "$defs": {
    "Subject": {
      "additionalProperties": false,
      "properties": {
        "id": {
          "description": "Natural id, eg `ST0000`, `ST0000/02`, `0021`.",
          "type": "string"
        },
        "type": {
          "description": "Entity type, eg `thread`, `wp`, `issue`.",
          "type": "string"
        }
      },
      "required": [
        "type",
        "id"
      ],
      "type": "object"
    }
  },
  "$schema": "https://json-schema.org/draft/2020-12/schema",
  "additionalProperties": false,
  "properties": {
    "id": {
      "description": "ULID -- lexically sortable, globally unique.",
      "type": "string"
    },
    "op": {
      "description": "The facade operation, eg `st.done`.",
      "type": "string"
    },
    "payload": {
      "description": "Operation-specific detail; opaque to the log."
    },
    "principal": {
      "type": "string"
    },
    "project_id": {
      "type": "string"
    },
    "subject": {
      "$ref": "#/$defs/Subject"
    },
    "ts": {
      "description": "RFC 3339 UTC, millisecond precision: `YYYY-MM-DDTHH:MM:SS.sssZ`.",
      "format": "date-time",
      "pattern": "^\\d{4}-\\d{2}-\\d{2}T\\d{2}:\\d{2}:\\d{2}\\.\\d{3}Z$",
      "type": "string"
    }
  },
  "required": [
    "id",
    "ts",
    "principal",
    "project_id",
    "op",
    "subject",
    "payload"
  ],
  "title": "Envelope",
  "type": "object",
  "x-intent-ver": "3.2.6",
  "x-schema-json-ver": 24
}
