{
  "id": "01M28TN0JZS9SYPF9DZQ8Y38DT",
  "ts": "2026-09-11T18:11:05.955Z",
  "principal": "local",
  "project_id": "fe0da6d7-6cca-425a-abca-b31e3c399be1",
  "op": "at.set",
  "subject": {
    "type": "at",
    "id": "ST0056/AT-00.19"
  },
  "payload": {
    "from": "to-write",
    "note": true,
    "to": "n-a"
  }
}
