{
  "id": "01M5MZEP1RWJ3GNJ41GWE3FB7J",
  "ts": "2026-10-23T18:13:00.088Z",
  "principal": "Matthew Sinclair <hello@matthewsinclair.com>",
  "project_id": "fe0da6d7-6cca-425a-abca-b31e3c399be1",
  "op": "wb.edit",
  "subject": {
    "type": "node",
    "id": "vc"
  },
  "payload": {
    "kind": "doing",
    "seq": 55,
    "text": "THE DAY AFTER 3.2.5, AFTER THE BOUNCE (vc, 2026-10-23). The line is drawn and 3.2.6 is a patch (decision 70); every open issue carries its spec in its record. STATE at the early-evening fold, in order: (1) CLOSED today: 0622, 0626, 0611, 0628, 0627 (landed 37ba1be83, closed 46b16553f), 0624 (landed 6a95721f2, closed 2b486174f, every verb printing its wrote: lines from the next pair, edit's on stderr). LANDED, closing later: 0623's generator at 6bd64b1c8 (closes after the shots refresh with the 3.2.6 pair, the refresh commit naming `guards` as the help row gained); the three verbs at 3c2ed2d39 (0616, 0617, 0618 close at the templates landing). The five views of today's closed issues left the tree at 36a2fdc02. FILED: 0631 (ic, behind the line), 0632 (cc, behind the line), 0633 (vc from rhadamanth-sysadm's and gyges-sysadm's reports: the upgrade's .prettierignore coverage; lane ic after 0623's close), 0634 (the intent-app cask proposal, hv's ruling); 0527 annotated with the gyges observation. (2) hv RULED in vc's TUI, the answer landing between vc's clock reads of 16:45Z and 18:10Z, the option as labelled: \"Bounce dc now\": dc's 0614 runs over 2b486174f when hv has bounced dc's session; vc's own order to dc to start unbounced was refused by the permission classifier as hv's call, rightly, and was not sent. (3) THE BOX, cargo slot: cc's 0630 whole-suite run now (ruled (B) on cc's note blob d6a3efc9f2ec: store-stale means bytes equal to the file index's row AND the row `clean`; the record's premise corrected at close; cc's window arm in place of dc's repro2), then dc's 0614 on dc's resume, then cc's 0630 landing and close, dc's 0614 landing and close. The bats slot: devbin-dc's 0206 pass (START 18:10Z, large), then devbin-cc's WP-08 plan3 run, then devbin-vc's landing suite, each on the END before it through vc. (4) After 0614 and 0630 land: ONE build all by vc on a clean tree, announced to every session on this machine first, `intent daemon restart` before any node runs intent, END announced; then ic's shots refresh and 0623's close; then cc's templates bank (refs/bank/cc/0616-0618/templates, blob 750d089d17ea) re-banked on the HEAD of the day, the whole shell half and the Rust arms on the final tree, landed, `intent claude skills sync`, 0616, 0617 and 0618 closed; kovacs-sysadm told the gate needs the 3.2.6 pair; then ic's 0633 (a second build all for it, or the next patch). (5) dc's preflight gate half on hv's ruling and dc's guards pass remainder after 0614; 0629 next session; D55 in Devbin (WP-08 green, HANDOVER with devbin-vc); ST0085 for hv's read; hv's hand items in intent/wip.md's TODO. No push, no release."
  }
}
