{
  "id": "01M28RHSVVAHMD3NS0X8PPQW9G",
  "ts": "2026-09-11T17:34:23.614Z",
  "principal": "local",
  "project_id": "fe0da6d7-6cca-425a-abca-b31e3c399be1",
  "op": "at.set",
  "subject": {
    "type": "at",
    "id": "ST0050/AT-01.3"
  },
  "payload": {
    "from": "green",
    "note": true,
    "to": "n-a"
  }
}
