{
  "id": "01M346C6GZ9P5K6151B68SE1KV",
  "ts": "2026-09-22T09:15:32.448Z",
  "principal": "Matthew Sinclair <hello@matthewsinclair.com>",
  "project_id": "fe0da6d7-6cca-425a-abca-b31e3c399be1",
  "op": "at.set",
  "subject": {
    "type": "at",
    "id": "ST0079/AT-02.3"
  },
  "payload": {
    "from": "red",
    "note": true,
    "to": "green"
  }
}
