{
  "id": "01M5JGJD1WSP7JP8MKP04AQVAF",
  "ts": "2026-10-22T19:14:24.444Z",
  "principal": "Matthew Sinclair <hello@matthewsinclair.com>",
  "project_id": "fe0da6d7-6cca-425a-abca-b31e3c399be1",
  "op": "wb.unclaim",
  "subject": {
    "type": "node",
    "id": "cc"
  },
  "payload": {
    "claim": "ISSUE:0609"
  }
}
