{
  "id": "01M5WM5SJYPMF1CG3Y335K81F0",
  "ts": "2026-10-26T17:29:49.918Z",
  "principal": "Matthew Sinclair <hello@matthewsinclair.com>",
  "project_id": "fe0da6d7-6cca-425a-abca-b31e3c399be1",
  "op": "wb.archive",
  "subject": {
    "type": "node",
    "id": "vc"
  },
  "payload": {
    "kind": "decision",
    "seq": 66
  }
}
