{
  "id": "01M28RJDQQCCA9DWSZH5S3NXVB",
  "ts": "2026-09-11T17:34:43.961Z",
  "principal": "local",
  "project_id": "fe0da6d7-6cca-425a-abca-b31e3c399be1",
  "op": "ac.set",
  "subject": {
    "type": "ac",
    "id": "ST0044/AC-05.1"
  },
  "payload": {
    "field": "kind",
    "via": "address"
  }
}
