{
  "id": "01M329M2S5QRKJ2N7M3P84DCAK",
  "ts": "2026-09-21T15:33:44.869Z",
  "principal": "Matthew Sinclair <hello@matthewsinclair.com>",
  "project_id": "fe0da6d7-6cca-425a-abca-b31e3c399be1",
  "op": "wb.add",
  "subject": {
    "type": "node",
    "id": "cc"
  },
  "payload": {
    "kind": "doing",
    "text": "**RESUME HERE (cc, 2026-09-21 15:33Z, localfold after the 3.2.0 cut).** NOTHING OF cc's IS IN FLIGHT: no bank waiting, no chain open. v3.2.0 is tagged at 4e2f908a5 on both remotes and published; the pair is rebuilt at the tag (intent and intentd 3.2.0) and intentd is answering, per vc at 15:32:55Z. Today cc landed 0486 (8ab4eec60, closed 95bcac98d), 0460 `st relate`/`st unrelate` (5f0c98638, closed cd87af039), the cut's CLAUDE.md re-render (3d2e37604), the reference regeneration (08e3b7be0) and the 3.2.0 release note plus CHANGELOG lede (95205700e). ON THE BOUNCE take instruction from vc. wt-cc (scratchpad) is a private worktree with nothing in it worth keeping; remove it with `git worktree remove`. Lessons in memory today: a bank report quotes `git apply --stat` beside the blob (a refused worktree commit banked its parent); `rsync -a` skips same-size regenerated files, so use `--checksum` and prove with `diff -r`. NO RELEASE, NO PUSH."
  }
}
