{
  "id": "01M36QCADG2RKZBN3GX85F9HFD",
  "ts": "2026-09-23T08:51:08.591Z",
  "principal": "Matthew Sinclair <hello@matthewsinclair.com>",
  "project_id": "fe0da6d7-6cca-425a-abca-b31e3c399be1",
  "op": "wb.archive",
  "subject": {
    "type": "node",
    "id": "ic"
  },
  "payload": {
    "kind": "doing",
    "seq": 99
  }
}
