{
  "id": "01M5JG9YK6M1HJ0T58RHDR2XEX",
  "ts": "2026-10-22T19:09:47.497Z",
  "principal": "Matthew Sinclair <hello@matthewsinclair.com>",
  "project_id": "fe0da6d7-6cca-425a-abca-b31e3c399be1",
  "op": "at.edit",
  "subject": {
    "type": "at",
    "id": "ST0075/AT-03.4"
  },
  "payload": {
    "via": "edit"
  }
}
