{
  "id": "01M5Q13RE3CZ8EVWEB114744WY",
  "ts": "2026-10-24T13:20:28.099Z",
  "principal": "Matthew Sinclair <hello@matthewsinclair.com>",
  "project_id": "fe0da6d7-6cca-425a-abca-b31e3c399be1",
  "op": "wb.archive",
  "subject": {
    "type": "node",
    "id": "dc"
  },
  "payload": {
    "kind": "doing",
    "seq": 136
  }
}
