{
  "id": "01M5YKVPSSEA0B88JXF9EM090V",
  "ts": "2026-10-27T12:02:48.257Z",
  "principal": "Matthew Sinclair <hello@matthewsinclair.com>",
  "project_id": "fe0da6d7-6cca-425a-abca-b31e3c399be1",
  "op": "at.set",
  "subject": {
    "type": "at",
    "id": "ST0086/AT-04.10"
  },
  "payload": {
    "from": "to-write",
    "note": false,
    "to": "red"
  }
}
