{
  "id": "01M4NX6FDZCNE79CF4C55XZVX8",
  "ts": "2026-10-11T16:37:06.627Z",
  "principal": "Matthew Sinclair <hello@matthewsinclair.com>",
  "project_id": "fe0da6d7-6cca-425a-abca-b31e3c399be1",
  "op": "issues.add",
  "subject": {
    "type": "issue",
    "id": "0591"
  },
  "payload": {
    "severity": "medium",
    "title": "the in-whiteboard skill is 51 KB, past the 20,000 characters a compact carries, so every compact costs every node a full reload (about 18k tokens)"
  }
}
