{
  "id": "01M5RQ8DJHX1K4A0E2F80VWBMD",
  "ts": "2026-10-25T05:06:43.921Z",
  "principal": "Matthew Sinclair <hello@matthewsinclair.com>",
  "project_id": "fe0da6d7-6cca-425a-abca-b31e3c399be1",
  "op": "wb.clear",
  "subject": {
    "type": "node",
    "id": "dc"
  },
  "payload": {
    "sender": "vc"
  }
}
